{
  "schema_version": "1",
  "run_id": "003",
  "task_slug": "quality-gates-remediation",
  "sender": "python-coding-agent",
  "receiver": "unit-test-agent",
  "created_at": "2026-03-20T05:30:00Z",
  "status": "completed",
  "changed_files": [
    {
      "file_path": "src/main.py",
      "change_type": "modified",
      "public_interface_summary": "Dependency wiring for account, profile, and statement services keeps the existing override contract while preserving fallback behavior when repository modules or required runtime configuration are unavailable. Route registration and endpoint URLs remain unchanged. Statement service override is still conditioned on both repositories being available.",
      "new_exceptions_raised": [
        "RepositoryException"
      ],
      "new_env_vars_required": []
    },
    {
      "file_path": "src/services/statement_service.py",
      "change_type": "modified",
      "public_interface_summary": "Statement e-mail business logic preserves request/response semantics for recipient resolution, default date-range behavior, and delivery status. SMTP configuration parsing and send flow keep the same ValidationException and RepositoryException mapping while maintaining OpenTelemetry span attributes (`operation_name`, `user_id`, and `request_id`).",
      "new_exceptions_raised": [
        "ValidationException",
        "RepositoryException"
      ],
      "new_env_vars_required": [
        "SMTP_HOST",
        "SMTP_PORT",
        "SMTP_SENDER_EMAIL",
        "SMTP_USERNAME",
        "SMTP_PASSWORD",
        "SMTP_USE_TLS",
        "SMTP_TIMEOUT_SECONDS"
      ]
    }
  ],
  "quality_gate_results": {
    "pylint": "failed",
    "docker_build": "passed",
    "trivy_scan": "passed"
  },
  "instructions_for_receiver": "Please focus tests on behavioral regression protection for the remediation scope: (1) dependency override/fallback behavior in src/main.py for get_account_service, get_profile_service, and get_statement_service; (2) statement e-mail semantics in src/services/statement_service.py, including recipient fallback, default period resolution, SMTP validation, and exception mapping. Quality-gate command results executed by coding agent: `pylint src/ --disable=import-error,unrecognized-option` failed due pre-existing repository-wide issues outside this remediation scope (e.g., line-length/newline/import placement in other modules and one undefined symbol in account service), `docker build -t bankapi .` passed, and `/opt/homebrew/bin/trivy image --exit-code 1 --severity HIGH,CRITICAL bankapi` passed with zero HIGH/CRITICAL findings."
}