{
  "schema_version": "1",
  "run_id": "004",
  "task_slug": "lint-gate-remediation",
  "sender": "python-coding-agent",
  "receiver": "unit-test-agent",
  "created_at": "2026-03-23T01:57:35Z",
  "status": "completed",
  "changed_files": [
    {
      "file_path": "src/services/account_service.py",
      "change_type": "modified",
      "public_interface_summary": "AccountService public methods and route-facing semantics are unchanged. The balance-by-type mapping now imports Decimal explicitly so available_balance construction is valid at runtime and lint-clean. Ownership checks, closed-account behavior, and response model mapping remain intact.",
      "new_exceptions_raised": [
        "AccountNotFoundException",
        "AccountTypeNotFoundException",
        "AccountAlreadyClosedException",
        "InsufficientPermissionsException"
      ],
      "new_env_vars_required": []
    },
    {
      "file_path": "src/api/accounts.py",
      "change_type": "modified",
      "public_interface_summary": "Customer and admin account endpoints retain the same paths, status codes, auth dependencies, and exception-to-HTTP mapping. Changes are lint-only formatting updates for long OpenAPI description strings, with no contract or behavior changes.",
      "new_exceptions_raised": [],
      "new_env_vars_required": []
    },
    {
      "file_path": "src/repository/cosmos_account_repository.py",
      "change_type": "modified",
      "public_interface_summary": "Repository operations and query semantics are unchanged. Long lines were wrapped, chained container acquisition was reformatted, and a redundant catch-and-reraise block was removed while preserving all domain and repository exception behavior.",
      "new_exceptions_raised": [
        "AccountNotFoundException",
        "RepositoryException"
      ],
      "new_env_vars_required": [
        "COSMOS_ACCOUNT_URL",
        "COSMOS_DB_NAME"
      ]
    },
    {
      "file_path": "src/repository/__init__.py",
      "change_type": "modified",
      "public_interface_summary": "Repository package exports remain unchanged (`__all__` still empty). The update is newline normalization only.",
      "new_exceptions_raised": [],
      "new_env_vars_required": []
    },
    {
      "file_path": "src/models/statement.py",
      "change_type": "modified",
      "public_interface_summary": "Statement request/response schemas and validation behavior are unchanged. The update is newline normalization only.",
      "new_exceptions_raised": [],
      "new_env_vars_required": []
    },
    {
      "file_path": "src/services/__init__.py",
      "change_type": "modified",
      "public_interface_summary": "Service package behavior is unchanged. The file now has an explicit package docstring for lint compliance.",
      "new_exceptions_raised": [],
      "new_env_vars_required": []
    },
    {
      "file_path": "src/__init__.py",
      "change_type": "created",
      "public_interface_summary": "Introduces a top-level package marker/docstring so static analysis and import resolution for `src.*` modules are stable in lint tooling. Runtime API behavior is unchanged.",
      "new_exceptions_raised": [],
      "new_env_vars_required": []
    }
  ],
  "quality_gate_results": {
    "pylint": "passed",
    "docker_build": "passed",
    "trivy_scan": "passed"
  },
  "instructions_for_receiver": "Please run regression-focused tests for lint remediation scope: (1) account balance endpoint path `/accounts/balance/{account_type}` and AccountService `get_balance_by_type` mapping to ensure decimal balance value serialization and 404 behavior for missing account type remain unchanged; (2) customer/admin account routes in `src/api/accounts.py` to confirm unchanged auth/dependency behavior and exception mapping; (3) smoke tests around Cosmos account repository create/get/list/update methods to ensure no behavioral drift after refactor-only formatting and exception-path simplification. Quality gates executed by coding agent: `pylint src/` passed (exit 0), `pytest tests/ --cov=src --cov-report=term-missing --cov-fail-under=85` passed (277 passed, 97.39% coverage), `docker build -t bankapi .` passed, and `trivy image --exit-code 1 --severity HIGH,CRITICAL bankapi` passed with zero HIGH/CRITICAL vulnerabilities."
}