{
  "schema_version": "1",
  "run_id": "002",
  "task_slug": "email-bank-statement",
  "sender": "python-coding-agent",
  "receiver": "unit-test-agent",
  "created_at": "2026-03-20T04:52:00Z",
  "status": "completed",
  "changed_files": [
    {
      "file_path": "src/api/health.py",
      "change_type": "modified",
      "public_interface_summary": "Keeps GET /health as a static, unversioned route and makes the healthy response contract explicit via an HTTP 200 status declaration and typed return payload. Endpoint behavior remains stable for deployment probes and continues to return JSON with a mandatory status field.",
      "new_exceptions_raised": [],
      "new_env_vars_required": []
    }
  ],
  "quality_gate_results": {
    "pylint": "failed",
    "docker_build": "passed",
    "trivy_scan": "failed"
  },
  "instructions_for_receiver": "Update/verify tests for GET /health contract stability only: route remains exactly /health, returns HTTP 200, and payload includes status with value healthy. Confirm no revision-specific URL assumptions were introduced. Note: focused verification `pytest tests/test_health.py -q` passed; full pylint/trivy gates are currently failing due pre-existing repository issues and image package vulnerabilities not introduced by this scoped change."
}